Product ID,Product Name,SKU,Type,Brand ID,Condition,Price,Sale Price,Cost Price,Retail Price,Calculated Price,Total Sold,View Count,Inventory Level,Inventory Warning Level,Is Visible,Availability,Weight,Categories,Category IDs,Is Featured,Custom Fields,In AU Storefront,In UK Storefront,In USA Storefront,Assigned Channel IDs,Variant Count,Variant SKUs,Min Variant Price,Max Variant Price,Page Title,Meta Description,Custom URL,Primary Image,Date Created,Date Modified
379,Essential Skills Reading Family Bundle Grade 3 and Grade 4,RM3,physical,40,New,10,,,,10,261,0,0,0,True,available,0,"42,43,45,46,49,112,127,131,160,179,184","42,43,45,46,49,112,127,131,160,179,184",False,"Bundle: true | Inventory: {us:0,sb:0} | Short Description: Support your child's success in Grades 3 & 4 with this Essential Reading Skills workbook bundle! With 430+ full-color pages, kids build 200 skills per grade through fun lessons, quizzes & rewards—making learning effective and enjoyable every day.",Y,N,Y,"1692941,1823086,1835881,1837891,1837908",1,RM3,10.0,10.0,Essential Skills Reading Bundle Grade 3 and Grade 4,,/essential-skills-reading-family-bundle-grade-3-and-grade-4/,https://cdn11.bigcommerce.com/s-sojvds60em/products/379/images/2113/RM3-grade-3-4-reading-workbooks-elementary_1_LR__03424.1742273395.220.290.jpg?c=1,18/03/2025,14/05/2026
380,Essential Skills Reading Family Bundle Grade 4 and Grade 5,RM4,physical,40,New,0,,,,,263,0,0,0,True,available,0,"42,43,45,46,49,112,127,131,160,179,184","42,43,45,46,49,112,127,131,160,179,184",False,"Bundle: true | Inventory: {us:0,sb:0} | Short Description: Boost your child's reading confidence with the Grade 4 and 5 Essential Reading Skills bundle! With 430+ full color pages and 200 skills per grade, kids strengthen comprehension, spelling and grammar through engaging lessons, reviews and rewards.",Y,N,Y,"1692941,1823086,1835881,1837891,1837908",1,RM4,,,Essential Skills Reading Bundle Grade 3 and Grade 4,,/essential-skills-reading-family-bundle-grade-4-and-grade-5/,https://cdn11.bigcommerce.com/s-sojvds60em/products/380/images/2116/RM4-grade-4-5-reading-workbooks-elementary_1_LR__96782.1742273645.220.290.jpg?c=1,18/03/2025,14/05/2026
381,12 month Program Access Gift E-Voucher to Reading Eggs and Mathseeds,COM12MTHUSGV,digital,38,New,227.99,149.99,,227.99,149.99,71,0,0,0,True,available,0,"42,43,44,45,110,111,112,113,114,115,116,118,134,135,136,139,171,173,179,184","42,43,44,45,110,111,112,113,114,115,116,118,134,135,136,139,171,173,179,184",False,"isDigital: true | ProductAccess: Reading, Math | SubscriptionPeriod: 12 | Short Description: Give the gift of learning with a 12 month Reading Eggs and Mathseeds e voucher! Kids enjoy fun lessons, games, songs and rewards that build reading, phonics and math skills. Includes Junior, Fast Phonics, Eggspress, 4000+ e books and worksheets. | Inventory: {sb:0,us:0}",Y,N,Y,"1692941,1823086,1835881,1837891,1837908",1,COM12MTHUSGV,227.99,227.99,12 Month Combined Program Access Gift E-Voucher (Reading Eggs + Mathseeds) | Reading Eggs Shop,Want to give the gift of learning? Provide 12 months of learning with Reading Eggs and Mathseeds - the multi-award winning online reading and mathematics programs.,/12-month-program-access-gift-e-voucher-to-reading-eggs-and-mathseeds-1/,https://cdn11.bigcommerce.com/s-sojvds60em/products/381/images/2150/Program_Access__37089.1743574736.220.290.png?c=1,02/04/2025,14/05/2026
382,Kindergarten Reading Workbook - 240 Essential Reading Skills - Homeschool,9781742153414-1,physical,38,New,19.95,,,19.95,19.95,165,0,3379,0,True,available,0,"174,179","174,179",False,"Age: 4-6 | Type: Single | Subject: Reading | Year: Kindergarten | Inventory: {us:100,us_event:50} | Short Description: Build your child’s reading confidence with the Kindergarten Essential Reading Skills workbook! 278 full color pages and 60 fun lessons cover phonics, sight words, comprehension and handwriting with quizzes and rewards to keep learning fun.",Y,N,Y,"1692941,1823086,1835881,1837891,1837908",1,9781742153414-1,19.95,19.95,Kindergarten Reading Workbook – 240 Reading Skills for Kindergarteners,"250+ pages of lessons and worksheets to build Kindergarten reading skills, including phonemic awareness, phonics, sight words and handwriting.",/kindergarten-reading-workbook-240-essential-reading-skills-homeschool/,https://cdn11.bigcommerce.com/s-sojvds60em/products/382/images/2169/9781742153414-kindergarten-reading-workbook_2__01421.1740347955.1280.1280__35390.1745454054.220.290.png?c=1,24/04/2025,15/05/2026
383,Grade 5 Reading Workbook – 200 Essential Reading Skills - Homeschool,9781742153513-1,physical,38,New,19.95,15.95,,19.95,15.95,21,0,1429,0,True,available,0,"174,179","174,179",False,"Inventory: {us_event:20} | Short Description: Fifth Grade Essential Reading Skills workbook builds 200 skills across 217 full color pages. Includes 72 comprehension lessons, spelling, grammar, reviews and rewards to help kids strengthen reading, writing and comprehension with confidence.",Y,N,Y,"1692941,1823086,1835881,1837891,1837908",1,9781742153513-1,19.95,19.95,Grade 5 Reading Workbook – 200 Reading Skills for 5th Grade,"200+ pages of lessons and worksheets to build Grade 5 skills in reading, spelling, grammar and comprehension. Includes a 36-week curriculum plan.",/grade-5-reading-workbook-200-essential-reading-skills-homeschool/,https://cdn11.bigcommerce.com/s-sojvds60em/products/383/images/2174/9781742153513-fifth-grade-reading-workbook_2__29319.1740357899.1280.1280__87475.1745454157.220.290.png?c=1,24/04/2025,15/05/2026
384,Grade 4 Reading Workbook – 200 Essential Reading Skills - Homeschool,9781742153506-1,physical,38,New,19.95,15.95,,19.95,15.95,42,0,2388,0,True,available,0,"174,179","174,179",False,"Inventory: {us_event:20} | Short Description: Fourth Grade Essential Reading Skills workbook builds 200 skills across 217 full color pages. Includes 72 comprehension lessons, spelling, grammar, reviews and rewards to help kids strengthen reading, writing and comprehension with confidence.",Y,N,Y,"1692941,1823086,1835881,1837891,1837908",1,9781742153506-1,19.95,19.95,Grade 4 Reading Workbook – 200 Reading Skills for 4th Grade,"200+ pages of lessons and worksheets to build Grade 4 skills in reading, spelling, grammar and comprehension. Includes a 36-week curriculum plan.",/grade-4-reading-workbook-200-essential-reading-skills-homeschool/,https://cdn11.bigcommerce.com/s-sojvds60em/products/384/images/2179/9781742153506-fourth-grade-reading-workbook_2__75294.1740357937.1280.1280__48731.1745454198.220.290.png?c=1,24/04/2025,15/05/2026
385,Grade 3 Reading Workbook – 200 Essential Reading Skills - Homeschool,9781742153490-1,physical,38,New,19.95,15.95,,19.95,15.95,45,0,2194,0,True,available,0,"174,179","174,179",False,"Inventory: {us_event:20} | Short Description: Third Grade Essential Reading Skills workbook builds 200 skills across 217 full color pages. Includes 72 comprehension lessons, spelling, grammar, reviews and rewards to help kids improve reading, writing and deeper comprehension with confidence.",Y,N,Y,"1692941,1823086,1835881,1837891,1837908",1,9781742153490-1,19.95,19.95,Grade 3 Reading Workbook – 200 Reading Skills for 3rd Grade,"200+ pages of lessons and worksheets to build Grade 3 skills in reading, spelling, grammar and    comprehension. Includes a 36-week curriculum plan.",/grade-3-reading-workbook-200-essential-reading-skills-homeschool/,https://cdn11.bigcommerce.com/s-sojvds60em/products/385/images/2184/9781742153490-third-grade-reading-workbook_2__56396.1740357987.1280.1280__83149.1745454251.220.290.png?c=1,24/04/2025,15/05/2026
386,Grade 2 Reading Workbook – 200 Essential Reading Skills - Homeschool,9781742153438-1,physical,38,New,19.95,15.95,,19.95,15.95,102,0,1078,0,True,available,0,"174,179","174,179",False,"Inventory: {us_event:40} | Short Description: Second Grade Essential Reading Skills workbook builds 200 skills across 217 full color pages. Includes 72 comprehension lessons, spelling, grammar, reviews and rewards to help kids strengthen reading, writing and comprehension with confidence.",Y,N,Y,"1692941,1823086,1835881,1837891,1837908",1,9781742153438-1,19.95,19.95,Grade 2 Reading Workbook – 200 Reading Skills for 2nd Grade,"200+ pages of lessons and worksheets to build Grade 2 skills in reading, spelling, grammar and    comprehension. Includes a 36-week curriculum plan.",/grade-2-reading-workbook-200-essential-reading-skills-homeschool/,https://cdn11.bigcommerce.com/s-sojvds60em/products/386/images/2188/9781742153438-second-grade-reading-workbook_2__14598.1740358039.1280.1280__13157.1745454405.220.290.png?c=1,24/04/2025,15/05/2026
387,Grade 1 Reading Workbook – 240 Essential Reading Skills - Homeschool,9781742153421-1,physical,38,New,19.95,,,19.95,19.95,152,0,3535,0,True,available,0,"174,179","174,179",False,"Inventory: {us_event:50} | Short Description: First Grade Essential Reading Skills workbook builds 240 skills with 60 lessons across 278 full color pages. Covers phonics, sight words, vocabulary, comprehension, spelling and writing with quizzes, reviews and rewards to boost confidence.",Y,N,Y,"1692941,1823086,1835881,1837891,1837908",1,9781742153421-1,19.95,19.95,Grade 1 Reading Workbook – 240 Reading Skills for First Grade,"250+ pages of lessons and worksheets to build Grade 1 reading skills, including phonics, vocabulary, handwriting and reading comprehension.",/grade-1-reading-workbook-240-essential-reading-skills-homeschool/,https://cdn11.bigcommerce.com/s-sojvds60em/products/387/images/2194/9781742153421-first-grade-reading-workbook_2__99883.1740358084.1280.1280__58090.1745454472.220.290.png?c=1,24/04/2025,15/05/2026
388,Grade 2 Math Workbook – 200 Essential Math Skills - Homeschool,9781742153407-1,physical,39,New,19.95,15.95,,19.95,15.95,89,0,1065,0,True,available,0,"174,179","174,179",False,"Inventory: {us_event:40} | Short Description: Help your child excel with the Second Grade Essential Math Skills workbook. 50 fun lessons on 260 full color pages build 200 skills in numbers, fractions, geometry, measurement, time and word problems.",Y,N,Y,"1692941,1823086,1835881,1837891,1837908",1,9781742153407-1,19.95,19.95,Grade 2 Math Workbook – 200 Essential Math Skills - Homeschool,"260+ pages of lessons and worksheets to build Grade 2 math skills in numbers, addition, subtraction, fractions, geometry, measurement and problem solving.",/grade-2-math-workbook-200-essential-math-skills-homeschool/,https://cdn11.bigcommerce.com/s-sojvds60em/products/388/images/2200/9781742153407-second-grade-math-workbook_2__01421.1740983760.1280.1280__69935.1745454659.220.290.png?c=1,24/04/2025,15/05/2026
389,Grade 1 Math Workbook – 200 Essential Math Skills - Homeschool,9781742153391-1,physical,39,New,19.95,,,19.95,19.95,110,0,3240,0,True,available,0,"174,179","174,179",False,"Inventory: {us_event:50} | Short Description: Help your child excel in math with the First Grade Essential Math Skills workbook. With 260 full color pages and 50 fun lessons, kids build 200 skills in numbers, shapes, measurement, time, money, fractions and more, with quizzes and rewards.",Y,N,Y,"1692941,1823086,1835881,1837891,1837908",1,9781742153391-1,19.95,19.95,Grade 1 Math Workbook – 200 Essential Math Skills - Homeschool,"260+ pages of lessons and worksheets to build Grade 1 math skills in numbers, operations, time, 2D and 3D shapes, measurement, geometry and problem solving.",/grade-1-math-workbook-200-essential-math-skills-homeschool/,https://cdn11.bigcommerce.com/s-sojvds60em/products/389/images/2205/9781742153391-first-grade-math-workbook_2__43449.1739931310.1280.1280__32074.1745454736.220.290.png?c=1,24/04/2025,15/05/2026
390,Kindergarten Math Workbook – 200 Essential Math Skills - Homeschool,9781742153384-1,physical,39,New,19.95,,,19.95,19.95,119,0,3036,0,True,available,0,"174,179","174,179",False,"Inventory: {us_event:50} | Short Description: Build your child's math confidence with the Kindergarten Essential Math Skills workbook! With 260 full color pages and 50 fun lessons, kids develop 200 skills in numbers, patterns, addition, subtraction, geometry, measurement, time and more.",Y,N,Y,"1692941,1823086,1835881,1837891,1837908",1,9781742153384-1,19.95,19.95,Kindergarten Math Workbook – 200 Essential Math Skills - Homeschool,"260+ pages of lessons and worksheets to build Kindergarten math skills in numbers, patterns, time, addition, subtraction, geometry and measurement.",/copy-of-kindergarten-math-workbook-200-essential-math-skills/,https://cdn11.bigcommerce.com/s-sojvds60em/products/390/images/2209/9781742153384-kindergarten-math-workbook_2__42158.1739931436.1280.1280__00169.1745455310.220.290.png?c=1,24/04/2025,15/05/2026
391,12-Month Program Access to Reading Eggs Homeschool Max,REHSMAX12MUS,digital,38,New,299,,,299,299,446,0,0,0,True,available,0,"42,153,171,172,179","42,153,171,172,179",True,"isDigital: true | ProductAccess: Reading, Math | SubscriptionPeriod: 12 | Short Description: Say hello to Reading Eggs Homeschool Max! This 12 month program gives access to Reading Eggs, Fast Phonics, Reading Eggspress and Mathseeds, plus bonus Reading Eggs Junior, with tools to assign lessons and track progress for homeschool success. | Inventory: {sb:0,us:0}",Y,N,Y,"1692941,1823086,1835881,1837891,1837908",1,REHSMAX12MUS,299.0,299.0,12-Month Program Access to Reading Eggs Homeschool Max,,/12-month-program-access-to-reading-eggs-homeschool-max/,https://cdn11.bigcommerce.com/s-sojvds60em/products/391/images/2251/B2C7327_REHSMAX250105_PA_OSA1080x1080-BC_1__00225.1747113644.220.290.png?c=1,02/05/2025,15/05/2026
392,12-month Program Access to Mathseeds,MS12MTHUS,digital,38,New,49.99,,,49.99,49.99,103,0,0,0,True,available,0,"153,171,172,179","153,171,172,179",False,"isDigital: true | ProductAccess: Math | SubscriptionPeriod: 12 | Short Description: Enjoy 12 months of Mathseeds, the award winning online math program for kids aged 3-9. Fun lessons, games and rewards build skills in numbers, shapes, time, money and more. Includes worksheets, reports and certificates. | Inventory: {sb:0,us:0}",Y,N,Y,"1692941,1823086,1835881,1837891,1837908",1,MS12MTHUS,49.99,49.99,12 Month Program Access to Mathseeds | Reading Eggs Shop,Give your child to 12 months of learning with Mathseeds - the multi-award winning online mathematics programs.,/12-month-program-access-to-mathseeds/,https://cdn11.bigcommerce.com/s-sojvds60em/products/392/images/2227/Mathseeds_Title__14644.1746587861.220.290.png?c=1,07/05/2025,15/05/2026
393,12-Month Program Access to Reading Eggs,RE12MTHUS,digital,38,New,227.99,149.99,,227.99,149.99,468,0,0,0,True,available,0,"153,171,172,179","153,171,172,179",False,"isDigital: true | ProductAccess: Reading | SubscriptionPeriod: 12 | Short Description: Reading Eggs is the award winning online program for ages 2-13. With phonics lessons, games, e books and 3500+ children’s titles, it builds reading skills in a fun way. Includes Junior, Fast Phonics and Eggspress. Mathseeds not included. | Inventory: {sb:0,us:0}",Y,N,Y,"1692941,1823086,1835881,1837891,1837908",1,RE12MTHUS,227.99,227.99,12 Month Program Access to Reading Eggs | Reading Eggs Shop,Provide your child to 12 months of learning with Reading Eggs  - the multi-award winning online reading program.,/12-month-program-access-to-reading-eggs/,https://cdn11.bigcommerce.com/s-sojvds60em/products/393/images/2249/Program_Access_5__60244.1746589484.220.290.png?c=1,07/05/2025,14/05/2026
394,ReadingEggs Mega Book Pack (Ages 4–7),140READEGG-E,physical,38,New,0,,,,,85,0,0,0,True,available,0,"153,179","153,179",True,"Bundle: true | Inventory: {us:30} | Short Description: The Reading Eggs Mega Book Pack is the ultimate bundle for ages 4-7! With 8 activity books, 80 reading books, flashcards, stickers and posters, it matches lessons 1-80 and helps kids build phonics, reading, spelling and writing skills at home.",N,N,Y,"1692941,1837891,1837908",1,140READEGG-E,,,Mega Reading Book Pack – Learn-to-Read Bundle | Ages 4–7,"Discover the best learn-to-read book bundle for kids. Includes activity books, reading books, alphabet and word flashcards, games, stickers and posters.",/reading-eggs-mega-book-pack-ages-4-7-esa/,https://cdn11.bigcommerce.com/s-sojvds60em/products/394/images/2294/139READEGG-learn-to-read-activity-books-flashcards-mega-pack_1_LR__16957.1739311474.1280.1280__15262.1747788846.220.290.jpg?c=1,21/05/2025,08/05/2026
395,ReadingEggs Book Pack Level 1 (Ages 4–6),RE7995PK1-E,physical,38,New,134.55,86,,134.55,86,218,0,0,0,True,available,1,"153,179","153,179",False,"Bundle: true | Inventory: {au:503,us:33,uk:522} | Short Description: The Reading Eggs Level 1 Book Pack is perfect for ages 4-6! With 4 activity books, 40 reading books, flashcards, stickers and posters, it matches lessons 1-40 and helps kids build early phonics, reading and writing skills at home in a fun way.",N,N,Y,"1692941,1837891,1837908",1,RE7995PK1-E,134.55,134.55,Level 1 Reading Book Set – Learn-to-Read Books | Ages 4–6,"The Level 1 Reading Book Set for kids includes learn-to-read activity books, reading books, alphabet and word flashcards, games, stickers and posters.",/readingeggs-book-pack-level-1-ages-4-6/,https://cdn11.bigcommerce.com/s-sojvds60em/products/395/images/2332/RE7995PK1-learn-to-read-activity-books-flashcards-pack-1_1_LR__16020.1738646248.1280.1280__61010.1747790032.220.290.jpg?c=1,21/05/2025,14/05/2026
396,Reading & Math Essential Skills - Kindergarten Bundle,RMK-E,physical,38,New,0,,,,,904,0,0,0,True,available,0,"153,179","153,179",False,"Bundle: true | Inventory: {us:116} | Short Description: Set your child up for success in reading & math! This fun-filled bundle of colorful Kindergarten workbooks builds 240 reading & 200 math skills with lessons, quizzes & rewards—making learning easy, engaging & confidence-boosting every day.",Y,N,Y,"1692941,1823086,1835881,1837891,1837908",1,RMK-E,,,Reading & Math Essential Skills - Kindergarten Bundle,Reading & Math Essential Skills for Kindergarten Bundle - E,/12-month-program-access-to-reading-eggs-mathseeds-reading-math-essential-skills-kindergarten-bundle/,https://cdn11.bigcommerce.com/s-sojvds60em/products/396/images/2363/RMK-kindergarten-reading-math-workbooks-bundle_1_LR__73170.1739880146.1280.1280__67863.1747792171.220.290.jpg?c=1,21/05/2025,14/05/2026
397,Reading & Math Essential Skills - First Grade Bundle,RM1-E,physical,38,New,0,,,,,880,0,0,0,True,available,0,"153,179","153,179",False,"Bundle: true | Age: 4-6 | Type: Bundle & Save | Year: First Grade | Subject: Reading & Math | Inventory: {us:0,sb:0} | Short Description: Set your child up for success in Grade 1 with this Reading & Math workbook bundle! With 530+ full-color pages, kids build 240 reading and 200 math skills through fun lessons, quizzes and rewards - making learning motivating and effective every day.",Y,N,Y,"1692941,1823086,1835881,1837891,1837908",1,RM1-E,,,,,/reading-math-essential-skills-for-first-grade-bundle-e/,https://cdn11.bigcommerce.com/s-sojvds60em/products/397/images/2378/RM1-first-grade-reading-math-workbooks-bundle_1_LR__07519.1739255514.1280.1280__54447.1747792420.220.290.jpg?c=1,21/05/2025,15/05/2026
398,Reading & Math Essential Skills - Second Grade Bundle,RM2-E,physical,38,New,0,,,,,686,0,0,0,True,available,0,"153,179","153,179",False,"Bundle: true | Age: 5-7 | Type: Bundle | Year: Second Grade | Subject: Reading & Math | Inventory: {us:167} | Short Description: Help your child excel in Grade 2 with this Reading & Math workbook bundle! With 470+ full-color pages, kids build 200 reading & 200 math skills through engaging lessons, quizzes & rewards—making learning effective, fun & motivating every day.",Y,N,Y,"1692941,1823086,1835881,1837891,1837908",1,RM2-E,,,,,/reading-math-essential-skills-for-second-grade-bundle-e/,https://cdn11.bigcommerce.com/s-sojvds60em/products/398/images/2388/RM2-second-grade-reading-math-workbooks-bundle_1_LR__58349.1739310910.1280.1280__72235.1747792602.220.290.jpg?c=1,21/05/2025,14/05/2026
399,Essential Skills Reading Family Bundle Grade 3 & Grade 4,RM3-E,physical,40,New,10,,,,10,333,0,0,0,True,available,0,"153,179","153,179",False,"Bundle: true | Inventory: {us:0,sb:0} | Short Descritpion: Support your child's success in Grades 3 & 4 with this Essential Reading Skills workbook bundle! With 430+ full-color pages, kids build 200 skills per grade through fun lessons, quizzes & rewards—making learning effective and enjoyable every day.",Y,N,Y,"1692941,1823086,1835881,1837891,1837908",1,RM3-E,10.0,10.0,Essential Skills Reading Bundle Grade 3 and Grade 4,,/essential-skills-reading-family-bundle-grade-3-grade-4/,https://cdn11.bigcommerce.com/s-sojvds60em/products/399/images/2400/RM3-grade-3-4-reading-workbooks-elementary_1_LR__03424.1742273395.1280.1280__88862.1747792689.220.290.jpg?c=1,21/05/2025,14/05/2026
400,Essential Skills Reading Family Bundle Grade 4 & Grade 5,RM4-E,physical,40,New,0,,,,,452,0,0,0,True,available,0,"153,179","153,179",False,"Bundle: true | Inventory: {us:100} | Short Description: Set your child up for success in Grades 4 & 5 with this Essential Reading Skills workbook bundle! With 430+ full-color pages, kids build 200+ reading skills per grade through fun lessons, quizzes & rewards every day.",Y,N,Y,"1692941,1823086,1835881,1837891,1837908",1,RM4-E,,,Essential Skills Reading Bundle Grade 3 and Grade 4,,/essential-skills-reading-family-bundle-grade-4-grade-5/,https://cdn11.bigcommerce.com/s-sojvds60em/products/400/images/2418/RM4-grade-4-5-reading-workbooks-elementary_1_LR__96782.1742273645.1280.1280__13865.1747792785.220.290.jpg?c=1,21/05/2025,14/05/2026
401,ReadingEggs Book Pack Level 2 (Ages 5–7),RE7995PK2-E,physical,38,New,0,,,,,141,0,0,0,True,available,1,"153,179","153,179",False,"Bundle: true | Inventory: {au:199,us:39,uk:454} | Short Description: The Reading Eggs Level 2 Book Pack is perfect for ages 5-7! With 4 activity books, 40 reading books, flashcards, stickers and posters, it supports lessons 41-80 and helps kids build phonics, reading and writing skills at home in a fun way.",N,N,Y,"1692941,1837891,1837908",1,RE7995PK2-E,,,Level 2 Reading Book Set – Learn-to-Read Books | Ages 5–7,"The Level 2 Reading Book Set for kids includes learn-to-read activity books, reading books, word flashcards, games, stickers and posters.",/readingeggs-book-pack-level-2-ages-5-7/,https://cdn11.bigcommerce.com/s-sojvds60em/products/401/images/2438/RE7995PK2-learn-to-read-activity-books-flashcards-pack-2_1_1__71827.1747355052.1280.1280__62203.1747950603.220.290.jpg?c=1,23/05/2025,14/05/2026
402,Grade 3 Math Workbook – 200 Essential Math Skills,9781923253162,physical,39,New,0,15.95,,19.95,15.95,1192,0,2267,0,True,available,0,"42,44,45,47,49,115,131,159,160,176,179,184","42,44,45,47,49,115,131,159,160,176,179,184",False,"Inventory: {us:2269,sb:3020} | Short Description: Help your child succeed in math with the Third Grade Essential Math Skills workbook! With 240 full color pages and 50 easy lessons, kids build 200 skills in numbers, fractions, geometry, measurement, statistics and more, with quizzes and rewards.",Y,N,Y,"1692941,1823086,1835881,1837891,1837908",1,9781923253162,,,Grade 3 Math Workbook – 200 Essential Math Skills,"240+ pages of lessons and worksheets to build Grade 3 math skills in numbers, addition, subtraction, fractions, geometry, measurement and problem solving.",/grade-3-math-workbook-200-essential-math-skills/,https://cdn11.bigcommerce.com/s-sojvds60em/products/402/images/2520/9781923253162_Mathseeds_grade_3_workbook_2__79085.1750747228.220.290.jpg?c=1,30/05/2025,15/05/2026
403,Year 3 Maths Workbook – 200 Essential Maths Skills,9781923253148,physical,39,New,19.95,15.95,,19.95,15.95,610,0,0,0,True,available,0,"Maths,All Products,By Age,Activity Books,Primary,Education Gifts for 3 Year Olds,Brands,ABC Mathseeds,Essential Skills,Workbooks,Primary (Ages 5–13),Best Sellers,Gift Shop,Free Workbook,Sale","25,29,30,34,55,61,65,76,77,88,154,175,177,180,182",False,"Inventory: {au:1529} | Short Description: Support your child's learning with the Year 3 Essential Maths Skills workbook! With 240 full color pages and 50 fun lessons, kids build 200 skills in numbers, fractions, geometry, measurement, statistics and more, with quizzes and rewards included.",Y,N,N,"1,1823086,1835881",1,9781923253148,19.95,19.95,Year 3 Maths Workbook – 200 Essential Maths Skills,"240+ pages of lessons and worksheets to build Year 3 maths skills in numbers, addition, subtraction, fractions, geometry, measurement and problem solving.",/year-3-maths-workbook-200-essential-maths-skills/,https://cdn11.bigcommerce.com/s-sojvds60em/products/403/images/2510/9781923253148_Mathseeds_Year_3_Workbook_2__17155.1750747099.220.290.jpg?c=1,12/06/2025,14/05/2026
404,Year 3 Maths Workbook - 200 Essential Maths Skills,9781923253155,physical,39,New,0,,,,,204,0,0,0,True,available,0,"35,36,37,39,94,105,106,108,157,178,181,183","35,36,37,39,94,105,106,108,157,178,181,183",False,"Inventory: {uk:2828} | Short Descritpion: Boost your child's maths confidence with the Year 3 Essential Maths Skills workbook! With 240 full color pages and 50 easy lessons, kids build 200 key skills in numbers, fractions, geometry, measurement and more, with quizzes and rewards included",Y,Y,N,"1692461,1823086,1835881,1837898",1,9781923253155,,,Year 3 Maths Workbook | Ages 7–8 | Reading Eggs Bookshop,"200 essential maths skills for Year 3 (ages 7–8) — numbers, fractions, multiplication, geometry and more. UK curriculum aligned. Aligned with Mathseeds Lessons 151–200.",/year-3-maths-workbook-200-essential-maths-skills-kmlv/,https://cdn11.bigcommerce.com/s-sojvds60em/products/404/images/2502/9781923253155_Mathseeds_year_3_1__53097.1750746997.220.290.jpg?c=1,12/06/2025,13/05/2026
