Product,401,ReadingEggs Book Pack Level 2 (Ages 5–7),physical,RE7995PK2-E,,none,0,0,0,0,0,0,38,1692941;1823086;1835881;1837891;1837908,153;179,"[{""id"":339,""name"":""Bundle"",""value"":""true""},{""id"":340,""name"":""Inventory"",""value"":""{au:199,us:39,uk:454}""},{""id"":464,""name"":""Short Description"",""value"":""The Reading Eggs Level 2 Book Pack is perfect for ages 5-7! With 4 activity books, 40 reading books, flashcards, stickers and posters, it supports lessons 41-80 and helps kids build phonics, reading and writing skills at home in a fun way.""}]",/readingeggs-book-pack-level-2-ages-5-7/,,,,,FALSE,0,1,0,0,0,TRUE,FALSE,0,New,FALSE,200,,,,,,,
Product,402,Grade 3 Math Workbook – 200 Essential Math Skills,physical,9781923253162,,none,2598,0,0,0,19.95,15.95,39,1692941;1823086;1835881;1837891;1837908,42;44;45;47;49;115;131;159;160;176;179;184,"[{""id"":400,""name"":""Inventory"",""value"":""{us:2598,sb:3020}""},{""id"":463,""name"":""Short Description"",""value"":""Help your child succeed in math with the Third Grade Essential Math Skills workbook! With 240 full color pages and 50 easy lessons, kids build 200 skills in numbers, fractions, geometry, measurement, statistics and more, with quizzes and rewards.""}]",/grade-3-math-workbook-200-essential-math-skills/,,,9.78174E+12,,FALSE,0,0,0,0,0,TRUE,FALSE,0,New,FALSE,0,,,,,,,
Product,403,Year 3 Maths Workbook – 200 Essential Maths Skills,physical,9781923253148,,none,0,0,19.95,0,19.95,15.95,39,1;1823086;1835881,25;29;30;34;55;61;65;76;77;88;154;175;177;180;182,"[{""id"":402,""name"":""Inventory"",""value"":""{au:1417}""},{""id"":462,""name"":""Short Description"",""value"":""Support your child's learning with the Year 3 Essential Maths Skills workbook! With 240 full color pages and 50 fun lessons, kids build 200 skills in numbers, fractions, geometry, measurement, statistics and more, with quizzes and rewards included.""}]",/year-3-maths-workbook-200-essential-maths-skills/,,,9.78174E+12,,FALSE,0,0,0,0,0,TRUE,FALSE,0,New,FALSE,0,,,,,,,
Product,404,Year 3 Maths Workbook - 200 Essential Maths Skills,physical,9781923253155,,none,0,0,0,0,0,0,39,1692461;1823086;1835881;1837898,35;36;37;39;94;105;106;108;157;178;181;183,"[{""id"":403,""name"":""Inventory"",""value"":""{uk:2828}""},{""id"":461,""name"":""Short Descritpion"",""value"":""Boost your child's maths confidence with the Year 3 Essential Maths Skills workbook! With 240 full color pages and 50 easy lessons, kids build 200 key skills in numbers, fractions, geometry, measurement and more, with quizzes and rewards included""}]",/year-3-maths-workbook-200-essential-maths-skills-kmlv/,,,9.78174E+12,,FALSE,0,0,0,0,0,TRUE,FALSE,0,New,FALSE,0,,,,,,,
Product,405,24-Month Program Access to Reading Eggs Homeschool Max,digital,REHSMAX24MUS,,none,0,0,598,0,299,0,38,1692941;1823086;1835881;1837891;1837908,42;153;171;172;179,"[{""id"":404,""name"":""isDigital"",""value"":""true""},{""id"":405,""name"":""ProductAccess"",""value"":""Reading, Math""},{""id"":406,""name"":""SubscriptionPeriod"",""value"":""24""},{""id"":460,""name"":""Short Description"",""value"":""Say hello to Reading Eggs Homeschool Max! This 24 month program gives full access to Reading Eggs, Fast Phonics, Reading Eggspress and Mathseeds, plus bonus Reading Eggs Junior, with tools to assign lessons and track progress for homeschool success.""},{""id"":550,""name"":""Inventory"",""value"":""{sb:0,us:0}""}]",/24-month-program-access-to-reading-eggs-homeschool-max/,,,,,FALSE,0,0,0,0,0,TRUE,TRUE,0,New,FALSE,0,,,,,,,
Product,406,24-Month Program Access to Reading Eggs,digital,RE24MTHUS,,none,0,0,139.98,0,227.99,149.99,38,1692941;1823086;1835881;1837891;1837908,153;171;172;179,"[{""id"":407,""name"":""isDigital"",""value"":""true""},{""id"":408,""name"":""ProductAccess"",""value"":""Reading""},{""id"":409,""name"":""SubscriptionPeriod"",""value"":""24""},{""id"":459,""name"":""Short Description"",""value"":""Enjoy 24 months of Reading Eggs, the award winning online program for ages 2-13. Fun lessons, games and e books build phonics and reading skills. Includes Junior, Fast Phonics and Eggspress. Mathseeds not included.""},{""id"":549,""name"":""Inventory"",""value"":""{sb:0,us:0}""}]",/24-month-program-access-to-reading-eggs/,,,,,FALSE,0,0,0,0,0,TRUE,FALSE,0,New,FALSE,0,,,,,,,
Product,407,24-month Program Access to Mathseeds,digital,MS24MTHUS,,none,0,0,99.98,0,49.99,0,39,1692941;1823086;1835881;1837891;1837908,153;171;172;179,"[{""id"":410,""name"":""isDigital"",""value"":""true""},{""id"":411,""name"":""ProductAccess"",""value"":""Math""},{""id"":412,""name"":""SubscriptionPeriod"",""value"":""24""},{""id"":458,""name"":""Short Description"",""value"":""Mathseeds is the award winning online math program for kids aged 3-9. Fun lessons, games and rewards teach numbers, shapes, time, money and more while building confidence and problem solving skills. Includes worksheets, reports and certificates.""},{""id"":548,""name"":""Inventory"",""value"":""{sb:0,us:0}""}]",/24-month-program-access-to-mathseeds/,,,,,FALSE,0,0,0,0,0,TRUE,FALSE,0,New,FALSE,0,,,,,,,
Product,408,24-Month Program Access to Reading Eggs & Mathseeds,digital,COM24MTHUS,,none,0,0,199.98,0,227.99,149.99,38,1692941;1823086;1835881;1837891;1837908,42;43;44;45;110;111;112;113;114;115;116;118;134;135;136;139;153;171;172;179,"[{""id"":413,""name"":""isDigital"",""value"":""true""},{""id"":414,""name"":""ProductAccess"",""value"":""Reading, Math""},{""id"":415,""name"":""SubscriptionPeriod"",""value"":""24""},{""id"":457,""name"":""Short Description"",""value"":""Get 24 months of full access to Reading Eggs and Mathseeds for up to 4 children. Includes Reading Eggs Junior, Reading Eggs, Reading Eggspress, Mathseeds and Fast Phonics - giving your child thousands of fun lessons, games and books.""},{""id"":547,""name"":""Inventory"",""value"":""{sb:0,us:0}""}]",/24-month-program-access-to-reading-eggs-mathseeds/,,,,,FALSE,0,0,0,0,0,TRUE,TRUE,0,New,FALSE,0,,,,,,,
Product,409,Essential Skills Reading Bundle Kindergarten to Grade 5,physical,REWBK5-E,,none,0,0,0,0,0,0,38,1692941;1823086;1835881;1837891;1837908,153;179,"[{""id"":416,""name"":""Bundle"",""value"":""true""},{""id"":417,""name"":""Inventory"",""value"":""{us:0,sb:0}""},{""id"":450,""name"":""Short Description"",""value"":""Support your child in Kindergarten through Grade 5 with this Essential Skills reading bundle. With over 1200 full color pages, children build phonics, comprehension, spelling and grammar through clear lessons, quizzes and rewards every day.""}]",/essential-skills-reading-bundle-kindergarten-to-grade-5/,,,,,FALSE,0,0,0,0,0,TRUE,FALSE,0,New,FALSE,0,,,,,,,
Product,410,Essential Skills Math Bundle Kindergarten to Year 3,physical,MSWBK3-E,,none,0,0,0,0,0,0,39,1692941;1823086;1835881;1837891;1837908,153;179,"[{""id"":418,""name"":""Bundle"",""value"":""true""},{""id"":419,""name"":""Inventory"",""value"":""{us:0,sb:0}""},{""id"":456,""name"":""Short Description"",""value"":""Build your child's math confidence from Kindergarten to Grade 3 with this Essential Skills workbook bundle! With 1000+ full-color pages, kids master 200 math skills per grade through engaging lessons, quizzes and rewards that make learning fun.""}]",/essential-skills-math-bundle-kindergarten-to-year-3/,,,,,FALSE,0,0,0,0,0,TRUE,FALSE,0,New,FALSE,0,,,,,,,
Product,411,Ultimate Reading & Math Essential Skills Bundle,physical,REMSWBK5-E,,none,0,0,0,0,0,0,38,1692941;1823086;1835881;1837891;1837908,153;179,"[{""id"":420,""name"":""Bundle"",""value"":""true""},{""id"":421,""name"":""Inventory"",""value"":""{us:0,sb:0}""},{""id"":452,""name"":""Short Description"",""value"":""Set your child up for success from Kindergarten to Grade 5 with this Essential Reading & Math workbook bundle! With 3500+ full-color pages, kids build key skills through engaging lessons, quizzes and rewards - making learning effective and fun.""}]",/ultimate-reading-math-essential-skills-bundle/,,,,,FALSE,0,0,0,0,0,TRUE,TRUE,0,New,FALSE,0,,,,,,,
Product,412,Readings Eggs Ultimate Book Pack (Ages 4 -7),physical,REMSULTBKB-E,,none,1,0,0,0,0,0,38,1692941;1823086;1835881;1837891;1837908,153;179,"[{""id"":422,""name"":""Bundle"",""value"":""true""},{""id"":423,""name"":""Inventory"",""value"":""{us:0,sb:0}""},{""id"":454,""name"":""Short Description"",""value"":""Give your child a strong start with the Ultimate Reading and Math Essentials Pack for ages 4-7. With workbooks, readers, flashcards, stickers and posters, kids build key skills and confidence while making learning fun and rewarding every day.""}]",/readings-eggs-ultimate-book-pack-ages-4-7/,,,,,FALSE,0,0,0,0,0,TRUE,FALSE,0,New,FALSE,0,,,,,,,
Product,413,Third Grade Reading and Math Essential Skills Bundle,physical,RM5,,none,0,0,10,0,0,0,40,1692941;1823086;1835881;1837891;1837908,42;43;45;46;49;112;127;131;160;179;184,"[{""id"":424,""name"":""Bundle"",""value"":""true""},{""id"":425,""name"":""Inventory"",""value"":""{us:0,sb:0}""},{""id"":441,""name"":""Short Description"",""value"":""Boost your child's confidence in Grade 3 with this Reading and Math workbook bundle! With 440+ full-color pages, kids build 200+ reading and 200+ math skills through fun lessons, quizzes and rewards every day.""}]",/third-grade-reading-and-math-essential-skills-bundle-2-full-color-workbooks/,,,,,FALSE,0,0,0,0,0,TRUE,FALSE,0,New,FALSE,0,,,,,,,
Product,414,Third Grade Reading & Math Essential Skills Bundle – 2 Full-Color Workbooks,physical,RM5-E,,none,0,0,10,0,0,0,40,1692941;1823086;1835881;1837891;1837908,153;179,"[{""id"":426,""name"":""Bundle"",""value"":""true""},{""id"":427,""name"":""Inventory"",""value"":""{us:0,sb:0}""},{""id"":440,""name"":""Short Description"",""value"":""Boost your child's confidence in Grade 3 with this Reading and Math workbook bundle! With 440+ full-color pages, kids build 200+ reading and 200+ math skills through fun lessons, quizzes and rewards every day.""}]",/essential-skills-reading-math-bundle-grade-3/,,,,,FALSE,0,0,0,0,0,TRUE,FALSE,0,New,FALSE,0,,,,,,,
Product,415,Ultimate Reading and Math Essential Skills Bundle,physical,REMSWBK5,,none,0,0,0,0,0,0,38,1692941;1823086;1835881;1837891;1837908,42;43;44;45;46;49;110;111;112;113;114;115;118;127;134;135;136;159;160;179;184,"[{""id"":430,""name"":""Bundle"",""value"":""true""},{""id"":431,""name"":""Inventory"",""value"":""{us:0,sb:0}""},{""id"":453,""name"":""Short Description"",""value"":""Set your child up for success from Kindergarten to Grade 5 with this Essential Reading & Math workbook bundle! With 3500+ full-color pages, kids build key skills through engaging lessons, quizzes and rewards - making learning effective and fun.""}]",/ultimate-reading-and-math-essential-skills-bundle/,,,,,FALSE,0,0,0,0,0,TRUE,FALSE,0,New,FALSE,0,,,,,,,
Product,416,Readings Eggs Ultimate Book Pack - Ages 4 -7,physical,REMSULTBKB,,none,0,0,0,0,0,0,38,1692941;1823086;1835881;1837891;1837908,42;43;44;45;46;47;49;111;112;114;115;118;125;126;127;131;134;135;136;139;159;160;179;184,"[{""id"":432,""name"":""Bundle"",""value"":""true""},{""id"":433,""name"":""Inventory"",""value"":""{us:0,sb:0}""},{""id"":455,""name"":""Short Description"",""value"":""Give your child a strong start with the Ultimate Reading and Math Essentials Pack for ages 4-7. With workbooks, readers, flashcards, stickers and posters, kids build key skills and confidence while making learning fun and rewarding every day.""}]",/readings-eggs-ultimate-book-pack-ages-4-7-6gjz/,,,,,FALSE,0,0,0,0,0,TRUE,FALSE,0,New,FALSE,0,,,,,,,
Product,417,Essential Skills Math Bundle (Kindergarten - Year 3),physical,MSWBK3,,none,0,0,0,0,0,0,39,1692941;1823086;1835881;1837891;1837908,42;44;45;46;49;114;115;118;127;134;136;139;159;160;179;184,"[{""id"":434,""name"":""Bundle"",""value"":""true""},{""id"":435,""name"":""Inventory"",""value"":""{us:0,sb:0}""}]",/essential-skills-math-bundle-kindergarten-year-3/,,,,,FALSE,0,0,0,0,0,TRUE,FALSE,0,New,FALSE,0,,,,,,,
Product,418,Essential Skills Reading Bundle (Kindergarten to Grade 5),physical,REWBK5,,none,0,0,0,0,0,0,38,1692941;1823086;1835881;1837891;1837908,42;43;45;46;49;111;112;118;127;134;135;139;158;159;160;179;184,"[{""id"":436,""name"":""Bundle"",""value"":""true""},{""id"":437,""name"":""Inventory"",""value"":""{us:0,sb:0}""},{""id"":451,""name"":""Short Description"",""value"":""Support your child in Kindergarten through Grade 5 with this Essential Skills reading bundle. With over 1200 full color pages, children build phonics, comprehension, spelling and grammar through clear lessons, quizzes and rewards every day.""}]",/essential-skills-reading-bundle-kindergarten-to-grade-5-qqgt/,,,,,FALSE,0,0,0,0,0,TRUE,FALSE,0,New,FALSE,0,,,,,,,
Product,419,24-Month Program Access to ABC Reading Eggs & ABC Mathseeds,digital,ABCREMS24MTHSUB,,none,0,0,199.98,0,227.99,149.99,38,1;1823086;1835881,24;25;29;30;50;51;52;53;54;55;59;60;61;65;70;76;143;154;165;166;175;177,"[{""id"":551,""name"":""isDigital"",""value"":""true""},{""id"":552,""name"":""ProductAccess"",""value"":""Reading, Math""},{""id"":553,""name"":""SubscriptionPeriod"",""value"":""24""},{""id"":554,""name"":""Short Description"",""value"":""Give your child 24 months of ABC Reading Eggs & Mathseeds. Fun, award-winning lessons build reading, phonics & maths skills, with progress tracking and rewards to keep learning exciting. Up to 4 children included.""},{""id"":555,""name"":""Inventory"",""value"":""{sb:0,us:0}""}]",/24-month-program-access-to-abc-reading-eggs-abc-mathseeds/,,,,,FALSE,0,0,0,0,0,TRUE,TRUE,0,New,FALSE,0,,,,,,,
Product,420,24-month Program Access to Reading Eggs and Mathseeds,digital,REMS24MTHSUB,,none,0,0,0,0,0,0,38,1692461;1823086;1835881;1837898,28;35;36;37;89;90;91;92;93;94;106;107;108;168;169;178;181,"[{""id"":556,""name"":""isDigital"",""value"":""true""},{""id"":557,""name"":""ProductAccess"",""value"":""Reading, Math""},{""id"":558,""name"":""SubscriptionPeriod"",""value"":""24""},{""id"":559,""name"":""Inventory"",""value"":""{uk:100,sb:0,us:0}""},{""id"":560,""name"":""Short Description"",""value"":""Give your child 24 months of Reading Eggs & Mathseeds. Fun, award-winning lessons build reading, phonics & maths skills, with progress tracking and rewards to keep learning exciting. Up to 4 children included.""}]",/24-month-program-access-to-reading-eggs-and-mathseeds/,,,,,FALSE,0,0,0,0,0,TRUE,FALSE,0,New,FALSE,0,,,,,,,
Product,421,Starting Out Reading Mini Books  Pack 1 (Ages 4–6),physical,9781923253285,,none,1500,0,19.95,0,19.95,19.95,38,1692941;1823086;1835881;1837891;1837908,42;43;45;46;110;111;112;118;126;158;159;179;184,"[{""id"":561,""name"":""Inventory"",""value"":""{au:3574,us:1500,uk:425,sb:169}""},{""id"":562,""name"":""Vimeo Video Id"",""value"":""1087649067""}]",/starting-out-reading-mini-books-pack-1-ages-4-6/,,,9.78192E+12,,FALSE,0,1.21,0,0,0,FALSE,FALSE,0,New,FALSE,0,,,,,,,
Product,422,Starting Out Reading Mini Books Pack 2 (Ages 4–6),physical,9781923253292,,none,1500,0,19.95,0,19.95,19.95,38,1692941;1823086;1835881;1837891;1837908,42;43;45;46;110;111;112;118;126;158;159;179;184,"[{""id"":563,""name"":""Inventory"",""value"":""{au:1347,us:1500,uk:593,sb:204}""},{""id"":564,""name"":""Vimeo Video Id"",""value"":""1087648814""}]",/starting-out-reading-mini-books-pack-2-ages-4-6/,,9.78192E+12,9.78192E+12,,FALSE,0,1.21,0,0,0,FALSE,FALSE,0,New,FALSE,0,,,,,,,
Product,423,Starting Out Reading Mini Books  Pack 3 (Ages 4–6),physical,9781923253308,,none,1500,0,19.95,0,19.95,14.95,38,1692941;1823086;1835881;1837891;1837908,24;28;29;30;31;35;37;38;42;43;45;46;50;51;52;59;63;89;90;91;101;110;111;112;118;126;143;154;155;156;157;158;159;175;177;178;179;184,"[{""id"":565,""name"":""Inventory"",""value"":""{au:823,us:1500,uk:614,sb:272}""},{""id"":566,""name"":""Vimeo Video Id"",""value"":""1087648872""}]",/starting-out-reading-mini-books-pack-3-ages-4-6/,,,9.78192E+12,,FALSE,0,1.21,0,0,0,FALSE,FALSE,0,New,FALSE,0,,,,,,,
Product,424,Starting Out Reading Mini Books Pack 4 (Ages 4–6),physical,9781923253315,,none,1500,0,19.95,0,19.95,19.95,38,1692941;1823086;1835881;1837891;1837908,24;28;29;30;31;35;37;38;42;43;45;46;50;51;52;59;63;89;90;91;101;110;111;112;118;126;143;154;155;156;157;158;159;175;177;178;179;184,"[{""id"":567,""name"":""Inventory"",""value"":""{au:1135,us:1500,uk:672,sb:241}""},{""id"":568,""name"":""Vimeo Video Id"",""value"":""1087648921""}]",/starting-out-reading-mini-books-pack-4-ages-4-6/,,9.78192E+12,9.78192E+12,,FALSE,0,1.21,0,0,0,FALSE,FALSE,0,New,FALSE,0,,,,,,,
Product,425,Learn to Read Activity Book 1 – Starting Out (Ages 4–6),physical,9781923253322,,none,1500,0,10.95,0,10.95,10.95,38,1692941;1823086;1835881;1837891;1837908,24;28;29;30;34;35;37;39;42;43;45;47;50;51;52;59;89;90;91;110;111;112;118;143;154;155;156;157;158;159;175;177;178;179;184,"[{""id"":569,""name"":""Inventory"",""value"":""{au:7148,us:1500,uk:611,sb:57}""},{""id"":570,""name"":""Vimeo Video Id"",""value"":""1087648971""},{""id"":571,""name"":""Short Description"",""value"":""Reading Eggs Activity Book 1 is the perfect first step for children learning to read. With fun, engaging activities, it builds confidence in recognising letters, sounds, and simple words while supporting the first 10 Reading Eggs lessons.""}]",/learn-to-read-activity-book-1-starting-out-ages-4-6/,,,9.78192E+12,,FALSE,0,0.28,0,0,0,FALSE,FALSE,0,New,FALSE,0,,,,,,,
Product,426,Learn to Read Activity Book 2 – Starting Out (Ages 4–6),physical,9781923253339,,none,1500,0,10.95,0,10.95,0,38,1692941;1823086;1835881;1837891;1837908,24;28;29;30;34;35;37;39;42;43;45;47;50;51;52;59;89;90;91;110;111;112;118;143;154;155;156;157;158;159;175;177;178;179;184,"[{""id"":572,""name"":""Inventory"",""value"":""{au:2943,us:1500,uk:789,sb:12}""},{""id"":573,""name"":""Vimeo Video Id"",""value"":""1087648995""}]",/learn-to-read-activity-book-2-starting-out-ages-4-6/,,9.78192E+12,9.78192E+12,,FALSE,0,0.28,0,0,0,FALSE,FALSE,0,New,FALSE,0,,,,,,,
Product,427,Learn to Read Activity Book 3 – Starting Out (Ages 4–6),physical,9781923253346,,none,1500,0,10.95,0,10.95,9.95,38,1692941;1823086;1835881;1837891;1837908,24;28;29;30;34;35;37;39;42;43;45;47;50;51;52;59;89;90;91;110;111;112;118;143;154;155;156;157;158;159;175;177;178;179;184,"[{""id"":574,""name"":""Inventory"",""value"":""{au:1358,us:1500,uk:840,sb:12}""},{""id"":575,""name"":""Vimeo Video Id"",""value"":""1087648613""},{""id"":576,""name"":""Short Description"",""value"":""Reading Eggs Activity Book 3 is full of fun activities that build early reading skills. Kids learn letters, sounds, phonics, handwriting and simple words in an easy step by step way. Can be used on its own or alongside the Reading Eggs program.""}]",/learn-to-read-activity-book-3-starting-out-ages-4-6/,,9.78192E+12,9.78192E+12,,FALSE,0,0.28,0,0,0,FALSE,FALSE,0,New,FALSE,0,,,,,,,
Product,428,Learn to Read Activity Book 4 – Starting Out (Ages 4–6),physical,9781923253353,,none,1500,0,10.95,0,10.95,10.95,38,1692941;1823086;1835881;1837891;1837908,24;28;29;30;34;35;37;39;42;43;45;47;50;51;52;59;89;90;91;110;111;112;118;143;154;155;156;157;158;159;175;177;178;179;184,"[{""id"":577,""name"":""Inventory"",""value"":""{au:936,us:1500,uk:855,sb:12}""},{""id"":578,""name"":""Vimeo Video Id"",""value"":""1087648650""},{""id"":579,""name"":""Short Description"",""value"":""Reading Eggs Activity Book 4 is packed with fun exercises that build phonics, handwriting and early reading skills\u2014perfect for beginners to gain confidence and enjoy learning at home.""}]",/learn-to-read-activity-book-4-starting-out-ages-4-6/,,9.78192E+12,9.78192E+12,,FALSE,0,0.28,0,0,0,FALSE,FALSE,0,New,FALSE,0,,,,,,,
Product,429,Alphabet Flashcards With Games Starting Out (Ages 3–5),physical,9781923253360,,none,2000,0,15.95,0,15.95,15.95,38,1692941;1823086;1835881;1837891;1837908,24;28;29;30;32;35;37;40;42;43;45;48;50;51;52;59;60;61;85;89;90;91;103;110;111;112;116;118;129;138;139;140;143;154;155;156;157;158;159;175;177;178;179;184,"[{""id"":580,""name"":""Inventory"",""value"":""{au:2646,us:2000,uk:784,sb:113}""},{""id"":581,""name"":""Short Description"",""value"":""Make learning letters fun with Reading Eggs Alphabet Flashcards! 7 self-checking games help kids recognise sounds, match words, and practise spelling while building reading confidence.""}]",/alphabet-flashcards-with-games-starting-out-ages-3-5/,,9.78192E+12,9.78192E+12,,FALSE,0,0.73,0,0,0,FALSE,FALSE,0,New,FALSE,0,,,,,,,
Product,430,Beginning to Read Mini Books  Pack 5 (Ages 5–7),physical,9781923253377,,none,1000,0,19.95,0,0,0,38,1692941;1823086;1835881;1837891;1837908,24;28;29;30;31;35;37;38;42;43;45;46;51;52;63;90;91;101;111;112;118;126;143;154;156;157;159;175;177;178;179;184,"[{""id"":582,""name"":""Inventory"",""value"":""{au:989,us:1000,uk:433,sb:442}""},{""id"":583,""name"":""Vimeo Video Id"",""value"":""1087648678""}]",/beginning-to-read-mini-books-pack-5-ages-5-7/,,9.78192E+12,9.78192E+12,,FALSE,0,1.3,0,0,0,FALSE,FALSE,0,New,FALSE,0,,,,,,,
Product,431,Beginning to Read Mini Books Pack 6 (Ages 5–7),physical,9781923253384,,none,1000,0,19.95,0,19.95,19.95,38,1692941;1823086;1835881;1837891;1837908,24;28;29;30;31;35;37;38;42;43;45;46;51;52;63;90;91;101;111;112;118;126;143;154;156;157;159;175;177;178;179;184,"[{""id"":584,""name"":""Inventory"",""value"":""{au:1428,us:1000,uk:436,sb:296}""},{""id"":585,""name"":""Vimeo Video Id"",""value"":""1087648708""}]",/beginning-to-read-mini-books-pack-6-ages-5-7/,,9.78192E+12,9.78192E+12,,FALSE,0,0.99,0,0,0,FALSE,FALSE,0,New,FALSE,0,,,,,,,
Product,432,Beginning to Read Mini Books Pack 7 (Ages 5–7),physical,9781923253391,,none,1000,0,19.95,0,19.95,19.95,38,1692941;1823086;1835881;1837891;1837908,24;28;29;30;31;35;37;38;42;43;45;46;51;52;63;90;91;101;111;112;118;126;143;154;156;157;159;175;177;178;179;184,"[{""id"":586,""name"":""Inventory"",""value"":""{au:2079,us:1000,uk:371,sb:340}""},{""id"":587,""name"":""Vimeo Video Id"",""value"":""1087648766""}]",/beginning-to-read-mini-books-pack-7-ages-5-7/,,9.78192E+12,9.78192E+12,,FALSE,0,1.1,0,0,0,FALSE,FALSE,0,New,FALSE,0,,,,,,,
Product,433,Beginning to Read Mini Books Pack 8 (Ages 5–7),physical,9781923253407,,none,1000,0,19.95,0,19.95,19.95,38,1692941;1823086;1835881;1837891;1837908,24;28;29;30;31;35;37;38;42;43;45;46;51;52;63;90;91;101;111;112;118;126;143;154;156;157;159;175;177;178;179;184,"[{""id"":588,""name"":""Inventory"",""value"":""{au:1847,us:1000,uk:361,sb:307}""},{""id"":589,""name"":""Vimeo Video Id"",""value"":""1087648368""}]",/beginning-to-read-mini-books-pack-8-ages-5-7/,,9.78192E+12,9.78192E+12,,FALSE,0,1.1,0,0,0,FALSE,FALSE,0,New,FALSE,0,,,,,,,
Product,434,Learn to Read Activity Book 5 – Beginning to Read (Ages 5–7),physical,9781923253414,,none,1000,0,10.95,0,10.95,10.95,38,1692941;1823086;1835881;1837891;1837908,24;28;29;30;34;35;37;39;42;43;45;47;51;52;90;91;111;112;118;143;154;156;157;159;175;177;178;179;184,"[{""id"":590,""name"":""Inventory"",""value"":""{au:3942,us:1000,uk:797,sb:270}""},{""id"":591,""name"":""Vimeo Video Id"",""value"":""1087648416""}]",/learn-to-read-activity-book-5-beginning-to-read-ages-5-7/,,9.78192E+12,9.78192E+12,,FALSE,0,0.21,0,0,0,FALSE,FALSE,0,New,FALSE,0,,,,,,,
Product,435,Learn to Read Activity Book 6 – Beginning to Read (Ages 5–7),physical,9781923253421,,none,1500,0,10.95,0,10.95,6.95,38,1692941;1823086;1835881;1837891;1837908,24;28;29;30;34;35;37;39;42;43;45;47;51;52;90;91;111;112;118;143;154;156;157;159;175;177;178;179;184,"[{""id"":592,""name"":""Inventory"",""value"":""{au:2313,us:1500,uk:700,sb:250}""},{""id"":593,""name"":""Vimeo Video Id"",""value"":""1087648451""}]",/learn-to-read-activity-book-6-beginning-to-read-ages-5-7/,,9.78192E+12,9.78192E+12,,FALSE,0,0.22,0,0,0,FALSE,FALSE,0,New,FALSE,0,,,,,,,
Product,436,Learn to Read Activity Book 7 – Beginning to Read (Ages 5–7),physical,9781923253438,,none,1500,0,10.95,0,10.95,10.95,38,1692941;1823086;1835881;1837891;1837908,24;28;29;30;34;35;37;39;42;43;45;47;51;52;90;91;111;112;118;143;154;156;157;159;175;177;178;179;184,"[{""id"":594,""name"":""Inventory"",""value"":""{au:3226,us:1500,uk:693,sb:240}""},{""id"":595,""name"":""Vimeo Video Id"",""value"":""1087648486""}]",/learn-to-read-activity-book-7-beginning-to-read-ages-5-7/,,9.78192E+12,9.78192E+12,,FALSE,0,0.3,0,0,0,FALSE,FALSE,0,New,FALSE,0,,,,,,,
Product,437,Learn to Read Activity Book 8 – Beginning to Read (Ages 5–7),physical,9781923253445,,none,1500,0,0,0,0,0,38,1692941;1837891,42;43;45;47;111;112;118;159;179;184,"[{""id"":596,""name"":""Inventory"",""value"":""{au:1312,us:1500,uk:781,sb:220}""},{""id"":597,""name"":""Vimeo Video Id"",""value"":""1087648516""}]",/learn-to-read-activity-book-8-beginning-to-read-ages-5-7/,,9.78192E+12,9.78192E+12,,FALSE,0,0.3,0,0,0,TRUE,FALSE,0,New,FALSE,0,,,,,,,
Product,438,Flashcards – Sight Words and Phonics – Beginning to Read (Ages 5 to 7),physical,9781923253452,,none,1000,0,15.95,0,15.95,15.95,38,1692941;1823086;1835881;1837891;1837908,24;28;29;30;32;35;37;40;42;43;45;48;51;52;85;90;91;103;111;112;118;129;143;154;156;157;159;175;177;178;179;184,"[{""id"":598,""name"":""Inventory"",""value"":""{au:1497,us:1000,uk:810,sb:256}""}]",/flashcards-sight-words-and-phonics-beginning-to-read-ages-5-to-7/,,9.78192E+12,9.78192E+12,,FALSE,0,0.74,0,0,0,FALSE,FALSE,0,New,FALSE,0,,,,,,,
Product,440,Grade 3 Math Workbook - 200 Essential Math Skills,physical,9781923253162-1,,none,2598,0,0,0,19.95,15.95,39,1692941;1823086;1835881;1837891;1837908,174,"[{""id"":609,""name"":""Inventory"",""value"":""{us:2704,sb:3020,us_event:50}""},{""id"":610,""name"":""Short Description"",""value"":""Help your child succeed in math with the Third Grade Essential Math Skills workbook! With 240 full color pages and 50 easy lessons, kids build 200 skills in numbers, fractions, geometry, measurement, statistics and more, with quizzes and rewards.""}]",/grade-3-math-workbook-200-essential-math-skills-wjpm/,,,9.78174E+12,,FALSE,0,0,0,0,0,TRUE,FALSE,0,New,FALSE,0,,,,,,,
